{"candidate":{"artifactDigest":"sha256:3333333333333333333333333333333333333333333333333333333333333333","artifactId":"300","candidateId":"candidate-1111111111111111111111111111111111111111-200-1","manifestSha256":"sha256:b927c6739dbe6aeb5c7828ebbc64a8b2d0e4bb5a01526ebe92c1c468da721381","workflowAttempt":1,"workflowRunId":"200"},"historySnapshotSha256":"sha256:4f53cda18c2baa0c0354bb5f9a3ecbe5ed12ab4d8e58b7162741027b7e35f4c7","kind":"release-publication-plan","mode":"publish","operationId":"release_operation_0001","repository":"greggorio/abaronesa-emporio","requestSha256":"sha256:184b968b0a83dcb46ba2c53fa93b2b90eb0558277b787562a4f1839eb3fb9bf0","schemaVersion":1,"target":{"existingReleaseId":null,"existingReleaseUrl":null,"manifestSha256":"sha256:b927c6739dbe6aeb5c7828ebbc64a8b2d0e4bb5a01526ebe92c1c468da721381","previousRelease":null,"release":"v0.0.1","sourceCommit":"1111111111111111111111111111111111111111"},"workflow":{"actor":"example-actor","actorId":"1","attempt":1,"event":"workflow_dispatch","runId":"400"}}
